{
  "schema_version": 1,
  "qid": "8a57f50a8438",
  "item_id": "8a57f50a8438",
  "status": "ok",
  "question_type": "solution",
  "latex": "9. 设 \\(D\\subset R^2\\) 是单连通有界闭区域，\\(I(D)=\\iint_D(1-x^2-y^2)\\,\\mathrm{d}x\\mathrm{d}y\\) 取得最大值的积分域记为 \\(D_1\\).\n(1) 求 \\(I(D_1)\\) 的值；\n(2) 计算 \\[\\oint_{\\partial D_1}\\frac{(xe^{x^2+2y^2}+y)\\,\\mathrm{d}x+(2ye^{x^2+2y^2}-x)\\,\\mathrm{d}y}{x^2+2y^2},\\] 其中 \\(\\partial D_1\\) 是 \\(D_1\\) 的正向边界.",
  "options": [],
  "image_transcriptions": [
    {
      "image": "img/question/8a57f50a8438-01.png",
      "latex": "9. 设 \\(D\\subset R^2\\) 是单连通有界闭区域，\\(I(D)=\\iint_D(1-x^2-y^2)\\,\\mathrm{d}x\\mathrm{d}y\\) 取得最大值的积分域记为 \\(D_1\\).\n(1) 求 \\(I(D_1)\\) 的值；\n(2) 计算 \\[\\oint_{\\partial D_1}\\frac{(xe^{x^2+2y^2}+y)\\,\\mathrm{d}x+(2ye^{x^2+2y^2}-x)\\,\\mathrm{d}y}{x^2+2y^2},\\] 其中 \\(\\partial D_1\\) 是 \\(D_1\\) 的正向边界."
    }
  ],
  "confidence": 0.99,
  "flags": [
    "raw_text_conflict"
  ],
  "notes": "raw_text 与图片冲突：图片第(2)问为分式，分母为 x^2+2y^2；raw_text 中存在乱码且遗漏分母。"
}