{
  "schema_version": 1,
  "qid": "343891b643ce",
  "item_id": "343891b643ce",
  "status": "ok",
  "question_type": "solution",
  "latex": "(9) 设曲面 $\\Sigma:z=x^2+y^2\\,(z\\le 1)$ 与平面 $z=1$ 所围均匀立体为 $V$，$M$ 为 $\\Sigma$ 上一动点，当曲面 $\\Sigma$ 在点 $M$ 处的切平面与 $V$ 的质心距离最近时，点 $M$ 的轨迹方程记为 $L$。\n(I) 求 $V$ 的质心坐标；\n(II) 求曲线 $L$，并计算\n\\[\nI=\\int_L x\\,dy-y\\,dx+z\\,dz,\n\\]\n从 $Oz$ 轴的正向往负向看去，$L$ 取逆时针方向。",
  "options": [],
  "image_transcriptions": [
    {
      "image": "img/question/343891b643ce-01.png",
      "latex": "(9) 设曲面 $\\Sigma:z=x^2+y^2\\,(z\\le 1)$ 与平面 $z=1$ 所围均匀立体为 $V$，$M$ 为 $\\Sigma$ 上一动点，当曲面 $\\Sigma$ 在点 $M$ 处的切平面与 $V$ 的质心距离最近时，点 $M$ 的轨迹方程记为 $L$。\n(I) 求 $V$ 的质心坐标；\n(II) 求曲线 $L$，并计算\n\\[\nI=\\int_L x\\,dy-y\\,dx+z\\,dz,\n\\]\n从 $Oz$ 轴的正向往负向看去，$L$ 取逆时针方向。"
    }
  ],
  "confidence": 0.98,
  "flags": [
    "raw_text_conflict"
  ],
  "notes": "raw_text 中的公式与图片有出入，已以图片为准。"
}