{
  "schema_version": 1,
  "qid": "db6118e86a95",
  "item_id": "db6118e86a95",
  "status": "ok",
  "question_type": "solution",
  "latex": "（1）计算曲面积分 $\\iint\\limits_{S}(2x+z)\\,\\mathrm{d}y\\mathrm{d}z+z\\,\\mathrm{d}x\\mathrm{d}y$，其中 $S$ 为有向曲面 $z=x^{2}+y^{2}(0\\leqslant z\\leqslant 1)$，其法向量与 $z$ 轴正向夹角为锐角.",
  "options": [],
  "image_transcriptions": [
    {
      "image": "img/question/db6118e86a95-01.png",
      "latex": "（1）计算曲面积分 $\\iint\\limits_{S}(2x+z)\\,\\mathrm{d}y\\mathrm{d}z+z\\,\\mathrm{d}x\\mathrm{d}y$，其中 $S$ 为有向曲面 $z=x^{2}+y^{2}(0\\leqslant z\\leqslant 1)$，其法向量与 $z$ 轴正向夹角为锐角."
    }
  ],
  "confidence": 0.96,
  "flags": [
    "raw_text_conflict"
  ],
  "notes": "raw_text 中 $z=x^{2}+y^{2}$ 与 $0\\leqslant z\\leqslant 1$ 被误识为 \"z=xP+y\" 与 \"OKz<1\"，已按图片更正。"
}