{
  "schema_version": 1,
  "qid": "845022242304",
  "item_id": "845022242304",
  "status": "ok",
  "question_type": "solution",
  "latex": "设 $\\Sigma$ 为曲面 $z=x^2+y^2\\ (z\\leqslant 1)$ 的上侧，计算曲面积分\n\\[I=\\iint_{\\Sigma}(x-1)^3\\,\\mathrm{d}y\\mathrm{d}z+(y-1)^3\\,\\mathrm{d}z\\mathrm{d}x+(z-1)\\,\\mathrm{d}x\\mathrm{d}y.\\]",
  "options": [],
  "image_transcriptions": [
    {
      "image": "img/question/845022242304-01.png",
      "latex": "设 $\\Sigma$ 为曲面 $z=x^2+y^2\\ (z\\leqslant 1)$ 的上侧，计算曲面积分\n\\[I=\\iint_{\\Sigma}(x-1)^3\\,\\mathrm{d}y\\mathrm{d}z+(y-1)^3\\,\\mathrm{d}z\\mathrm{d}x+(z-1)\\,\\mathrm{d}x\\mathrm{d}y.\\]"
    }
  ],
  "confidence": 0.97,
  "flags": [
    "raw_text_conflict"
  ],
  "notes": "图片中积分记为 I，且第一、二项分别为 (x-1)^3、(y-1)^3，第三项为 (z-1)，条件为 z\\leqslant 1；raw_text 中的 \"7=\"、\"(x-1)'\"、\"(y-1)P\"、\"(zs1)\" 为 OCR 噪声，以图片为准。"
}