{
  "schema_version": 1,
  "qid": "c0a182647e09",
  "item_id": "c0a182647e09",
  "status": "ok",
  "question_type": "fill_blank",
  "latex": "已知三个向量 $a,b,c$，其中 $c\\perp a,c\\perp b$，$a$ 与 $b$ 的夹角为 $\\frac{\\pi}{6}$，$|a|=6,|b|=|c|=3$，则 $(a\\times b)\\cdot c=\\underline{\\hspace{4em}}$",
  "options": [],
  "image_transcriptions": [
    {
      "image": "img/question/c0a182647e09-01.png",
      "latex": "已知三个向量 $a,b,c$，其中 $c\\perp a,c\\perp b$，$a$ 与 $b$ 的夹角为 $\\frac{\\pi}{6}$，$|a|=6,|b|=|c|=3$，则 $(a\\times b)\\cdot c=\\underline{\\hspace{4em}}$"
    }
  ],
  "confidence": 0.99,
  "flags": [],
  "notes": ""
}